<?xml version="1.0"?>
<Notes xmlns:xsi="http://www.w3.org/2001/XMLSchema-instance" xsi:noNamespaceSchemaLocation="C://xampp/htdocs/GestionScolarite-XML/Validation_xml/Notes.xsd">
  <Note>
    <CNE>19000031</CNE>
    <LastName>Ginf1_FN1</LastName>
    <FirstName>Ginf1_LN1</FirstName>
    <Matiere codeMatiere="GINF11">19</Matiere>
    <Matiere codeMatiere="GINF12">15</Matiere>
    <Matiere codeMatiere="GINF13">16</Matiere>
    <Matiere codeMatiere="GINF14">12</Matiere>
    <Matiere codeMatiere="GINF15">12</Matiere>
    <Matiere codeMatiere="GINF16">20</Matiere>
    <Matiere codeMatiere="GINF21">12</Matiere>
    <Matiere codeMatiere="GINF22">13</Matiere>
    <Matiere codeMatiere="GINF23">12</Matiere>
    <Matiere codeMatiere="GINF24">16</Matiere>
    <Matiere codeMatiere="GINF25">20</Matiere>
    <Matiere codeMatiere="GINF26">12</Matiere>
  </Note>
  <Note>
    <CNE>19000032</CNE>
    <LastName>Ginf1_FN2</LastName>
    <FirstName>Ginf1_LN2</FirstName>
    <Matiere codeMatiere="GINF11">13</Matiere>
    <Matiere codeMatiere="GINF12">13</Matiere>
    <Matiere codeMatiere="GINF13">19</Matiere>
    <Matiere codeMatiere="GINF14">13</Matiere>
    <Matiere codeMatiere="GINF15">15</Matiere>
    <Matiere codeMatiere="GINF16">20</Matiere>
    <Matiere codeMatiere="GINF21">15</Matiere>
    <Matiere codeMatiere="GINF22">7</Matiere>
    <Matiere codeMatiere="GINF23">13</Matiere>
    <Matiere codeMatiere="GINF24">11</Matiere>
    <Matiere codeMatiere="GINF25">15</Matiere>
    <Matiere codeMatiere="GINF26">12</Matiere>
  </Note>
  <Note>
    <CNE>19000033</CNE>
    <LastName>Ginf1_FN3</LastName>
    <FirstName>Ginf1_LN3</FirstName>
    <Matiere codeMatiere="GINF11">14</Matiere>
    <Matiere codeMatiere="GINF12">18</Matiere>
    <Matiere codeMatiere="GINF13">16</Matiere>
    <Matiere codeMatiere="GINF14">12</Matiere>
    <Matiere codeMatiere="GINF15">17</Matiere>
    <Matiere codeMatiere="GINF16">16</Matiere>
    <Matiere codeMatiere="GINF21">12</Matiere>
    <Matiere codeMatiere="GINF22">10</Matiere>
    <Matiere codeMatiere="GINF23">13</Matiere>
    <Matiere codeMatiere="GINF24">12</Matiere>
    <Matiere codeMatiere="GINF25">12</Matiere>
    <Matiere codeMatiere="GINF26">19</Matiere>
  </Note>
  <Note>
    <CNE>19000034</CNE>
    <LastName>Ginf1_FN4</LastName>
    <FirstName>Ginf1_LN4</FirstName>
    <Matiere codeMatiere="GINF11">16</Matiere>
    <Matiere codeMatiere="GINF12">12</Matiere>
    <Matiere codeMatiere="GINF13">14</Matiere>
    <Matiere codeMatiere="GINF14">14</Matiere>
    <Matiere codeMatiere="GINF15">12</Matiere>
    <Matiere codeMatiere="GINF16">20</Matiere>
    <Matiere codeMatiere="GINF21">17</Matiere>
    <Matiere codeMatiere="GINF22">15</Matiere>
    <Matiere codeMatiere="GINF23">17</Matiere>
    <Matiere codeMatiere="GINF24">12</Matiere>
    <Matiere codeMatiere="GINF25">14</Matiere>
    <Matiere codeMatiere="GINF26">14</Matiere>
  </Note>
  <Note>
    <CNE>19000035</CNE>
    <LastName>Ginf1_FN5</LastName>
    <FirstName>Ginf1_LN5</FirstName>
    <Matiere codeMatiere="GINF11">12</Matiere>
    <Matiere codeMatiere="GINF12">8</Matiere>
    <Matiere codeMatiere="GINF13">13</Matiere>
    <Matiere codeMatiere="GINF14">13</Matiere>
    <Matiere codeMatiere="GINF15">12</Matiere>
    <Matiere codeMatiere="GINF16">11</Matiere>
    <Matiere codeMatiere="GINF21">8</Matiere>
    <Matiere codeMatiere="GINF22">13</Matiere>
    <Matiere codeMatiere="GINF23">17</Matiere>
    <Matiere codeMatiere="GINF24">12</Matiere>
    <Matiere codeMatiere="GINF25">17</Matiere>
    <Matiere codeMatiere="GINF26">20</Matiere>
  </Note>
  <Note>
    <CNE>19000036</CNE>
    <LastName>Ginf1_FN6</LastName>
    <FirstName>Ginf1_LN6</FirstName>
    <Matiere codeMatiere="GINF11">18</Matiere>
    <Matiere codeMatiere="GINF12">17</Matiere>
    <Matiere codeMatiere="GINF13">17</Matiere>
    <Matiere codeMatiere="GINF14">20</Matiere>
    <Matiere codeMatiere="GINF15">12</Matiere>
    <Matiere codeMatiere="GINF16">12</Matiere>
    <Matiere codeMatiere="GINF21">12</Matiere>
    <Matiere codeMatiere="GINF22">12</Matiere>
    <Matiere codeMatiere="GINF23">14</Matiere>
    <Matiere codeMatiere="GINF24">18</Matiere>
    <Matiere codeMatiere="GINF25">13</Matiere>
    <Matiere codeMatiere="GINF26">12</Matiere>
  </Note>
  <Note>
    <CNE>19000037</CNE>
    <LastName>Ginf1_FN7</LastName>
    <FirstName>Ginf1_LN7</FirstName>
    <Matiere codeMatiere="GINF11">10</Matiere>
    <Matiere codeMatiere="GINF12">12</Matiere>
    <Matiere codeMatiere="GINF13">12</Matiere>
    <Matiere codeMatiere="GINF14">18</Matiere>
    <Matiere codeMatiere="GINF15">13</Matiere>
    <Matiere codeMatiere="GINF16">19</Matiere>
    <Matiere codeMatiere="GINF21">16</Matiere>
    <Matiere codeMatiere="GINF22">16</Matiere>
    <Matiere codeMatiere="GINF23">16</Matiere>
    <Matiere codeMatiere="GINF24">18</Matiere>
    <Matiere codeMatiere="GINF25">16</Matiere>
    <Matiere codeMatiere="GINF26">12</Matiere>
  </Note>
  <Note>
    <CNE>19000038</CNE>
    <LastName>Ginf1_FN8</LastName>
    <FirstName>Ginf1_LN8</FirstName>
    <Matiere codeMatiere="GINF11">12</Matiere>
    <Matiere codeMatiere="GINF12">12</Matiere>
    <Matiere codeMatiere="GINF13">20</Matiere>
    <Matiere codeMatiere="GINF14">11</Matiere>
    <Matiere codeMatiere="GINF15">18</Matiere>
    <Matiere codeMatiere="GINF16">14</Matiere>
    <Matiere codeMatiere="GINF21">12</Matiere>
    <Matiere codeMatiere="GINF22">12</Matiere>
    <Matiere codeMatiere="GINF23">12</Matiere>
    <Matiere codeMatiere="GINF24">20</Matiere>
    <Matiere codeMatiere="GINF25">13</Matiere>
    <Matiere codeMatiere="GINF26">12</Matiere>
  </Note>
  <Note>
    <CNE>19000039</CNE>
    <LastName>Ginf1_FN9</LastName>
    <FirstName>Ginf1_LN9</FirstName>
    <Matiere codeMatiere="GINF11">13</Matiere>
    <Matiere codeMatiere="GINF12">13</Matiere>
    <Matiere codeMatiere="GINF13">20</Matiere>
    <Matiere codeMatiere="GINF14">13</Matiere>
    <Matiere codeMatiere="GINF15">12</Matiere>
    <Matiere codeMatiere="GINF16">18</Matiere>
    <Matiere codeMatiere="GINF21">9</Matiere>
    <Matiere codeMatiere="GINF22">12</Matiere>
    <Matiere codeMatiere="GINF23">20</Matiere>
    <Matiere codeMatiere="GINF24">20</Matiere>
    <Matiere codeMatiere="GINF25">17</Matiere>
    <Matiere codeMatiere="GINF26">14</Matiere>
  </Note>
  <Note>
    <CNE>19000040</CNE>
    <LastName>Ginf1_FN10</LastName>
    <FirstName>Ginf1_LN10</FirstName>
    <Matiere codeMatiere="GINF11">12</Matiere>
    <Matiere codeMatiere="GINF12">20</Matiere>
    <Matiere codeMatiere="GINF13">13</Matiere>
    <Matiere codeMatiere="GINF14">16</Matiere>
    <Matiere codeMatiere="GINF15">12</Matiere>
    <Matiere codeMatiere="GINF16">12</Matiere>
    <Matiere codeMatiere="GINF21">15</Matiere>
    <Matiere codeMatiere="GINF22">15</Matiere>
    <Matiere codeMatiere="GINF23">20</Matiere>
    <Matiere codeMatiere="GINF24">10</Matiere>
    <Matiere codeMatiere="GINF25">13</Matiere>
    <Matiere codeMatiere="GINF26">19</Matiere>
  </Note>
</Notes>
