<?xml version="1.0"?>
<Notes xmlns:xsi="http://www.w3.org/2001/XMLSchema-instance" xsi:noNamespaceSchemaLocation="C://xampp/htdocs/GestionScolarite-XML/Validation_xml/Notes.xsd">
  <Note>
    <CNE>18000041</CNE>
    <LastName>G3EI2_FN1</LastName>
    <FirstName>G3EI2_LN1</FirstName>
    <Matiere codeMatiere="G3EI31">12.76</Matiere>
    <Matiere codeMatiere="G3EI32">10.73</Matiere>
    <Matiere codeMatiere="G3EI33">15.06</Matiere>
    <Matiere codeMatiere="G3EI34">12</Matiere>
    <Matiere codeMatiere="G3EI35">9.09</Matiere>
    <Matiere codeMatiere="G3EI36">12</Matiere>
    <Matiere codeMatiere="G3EI37">19.32</Matiere>
    <Matiere codeMatiere="G3EI38">12</Matiere>
    <Matiere codeMatiere="G3EI39">11.44</Matiere>
  </Note>
  <Note>
    <CNE>18000042</CNE>
    <LastName>G3EI2_FN2</LastName>
    <FirstName>G3EI2_LN2</FirstName>
    <Matiere codeMatiere="G3EI31">13.76</Matiere>
    <Matiere codeMatiere="G3EI32">18.7</Matiere>
    <Matiere codeMatiere="G3EI33">15.13</Matiere>
    <Matiere codeMatiere="G3EI34">18</Matiere>
    <Matiere codeMatiere="G3EI35">13</Matiere>
    <Matiere codeMatiere="G3EI36">13.6</Matiere>
    <Matiere codeMatiere="G3EI37">19.65</Matiere>
    <Matiere codeMatiere="G3EI38">15.98</Matiere>
    <Matiere codeMatiere="G3EI39">18.64</Matiere>
  </Note>
  <Note>
    <CNE>18000043</CNE>
    <LastName>G3EI2_FN3</LastName>
    <FirstName>G3EI2_LN3</FirstName>
    <Matiere codeMatiere="G3EI31">12</Matiere>
    <Matiere codeMatiere="G3EI32">12.7</Matiere>
    <Matiere codeMatiere="G3EI33">15.77</Matiere>
    <Matiere codeMatiere="G3EI34">4</Matiere>
    <Matiere codeMatiere="G3EI35">12.7</Matiere>
    <Matiere codeMatiere="G3EI36">17.76</Matiere>
    <Matiere codeMatiere="G3EI37">12.39</Matiere>
    <Matiere codeMatiere="G3EI38">13.09</Matiere>
    <Matiere codeMatiere="G3EI39">14.83</Matiere>
  </Note>
  <Note>
    <CNE>18000044</CNE>
    <LastName>G3EI2_FN4</LastName>
    <FirstName>G3EI2_LN4</FirstName>
    <Matiere codeMatiere="G3EI31">11.8</Matiere>
    <Matiere codeMatiere="G3EI32">9.6</Matiere>
    <Matiere codeMatiere="G3EI33">16.26</Matiere>
    <Matiere codeMatiere="G3EI34">5.87</Matiere>
    <Matiere codeMatiere="G3EI35">12.76</Matiere>
    <Matiere codeMatiere="G3EI36">12.98</Matiere>
    <Matiere codeMatiere="G3EI37">13.09</Matiere>
    <Matiere codeMatiere="G3EI38">14</Matiere>
    <Matiere codeMatiere="G3EI39">17.3</Matiere>
  </Note>
  <Note>
    <CNE>18000045</CNE>
    <LastName>G3EI2_FN5</LastName>
    <FirstName>G3EI2_LN5</FirstName>
    <Matiere codeMatiere="G3EI31">16.9</Matiere>
    <Matiere codeMatiere="G3EI32">18</Matiere>
    <Matiere codeMatiere="G3EI33">16.66</Matiere>
    <Matiere codeMatiere="G3EI34">13</Matiere>
    <Matiere codeMatiere="G3EI35">14</Matiere>
    <Matiere codeMatiere="G3EI36">10</Matiere>
    <Matiere codeMatiere="G3EI37">17.88</Matiere>
    <Matiere codeMatiere="G3EI38">12.04</Matiere>
    <Matiere codeMatiere="G3EI39">15.84</Matiere>
  </Note>
  <Note>
    <CNE>18000046</CNE>
    <LastName>G3EI2_FN6</LastName>
    <FirstName>G3EI2_LN6</FirstName>
    <Matiere codeMatiere="G3EI31">14.74</Matiere>
    <Matiere codeMatiere="G3EI32">13</Matiere>
    <Matiere codeMatiere="G3EI33">11.85</Matiere>
    <Matiere codeMatiere="G3EI34">18.65</Matiere>
    <Matiere codeMatiere="G3EI35">15.66</Matiere>
    <Matiere codeMatiere="G3EI36">11.29</Matiere>
    <Matiere codeMatiere="G3EI37">8.66</Matiere>
    <Matiere codeMatiere="G3EI38">9.5</Matiere>
    <Matiere codeMatiere="G3EI39">16.9</Matiere>
  </Note>
  <Note>
    <CNE>18000047</CNE>
    <LastName>G3EI2_FN7</LastName>
    <FirstName>G3EI2_LN7</FirstName>
    <Matiere codeMatiere="G3EI31">12.86</Matiere>
    <Matiere codeMatiere="G3EI32">10.86</Matiere>
    <Matiere codeMatiere="G3EI33">14.11</Matiere>
    <Matiere codeMatiere="G3EI34">10</Matiere>
    <Matiere codeMatiere="G3EI35">12.78</Matiere>
    <Matiere codeMatiere="G3EI36">13.17</Matiere>
    <Matiere codeMatiere="G3EI37">13.82</Matiere>
    <Matiere codeMatiere="G3EI38">10.83</Matiere>
    <Matiere codeMatiere="G3EI39">14</Matiere>
  </Note>
  <Note>
    <CNE>18000048</CNE>
    <LastName>G3EI2_FN8</LastName>
    <FirstName>G3EI2_LN8</FirstName>
    <Matiere codeMatiere="G3EI31">16.51</Matiere>
    <Matiere codeMatiere="G3EI32">18.84</Matiere>
    <Matiere codeMatiere="G3EI33">13.45</Matiere>
    <Matiere codeMatiere="G3EI34">12</Matiere>
    <Matiere codeMatiere="G3EI35">12.07</Matiere>
    <Matiere codeMatiere="G3EI36">14.63</Matiere>
    <Matiere codeMatiere="G3EI37">12</Matiere>
    <Matiere codeMatiere="G3EI38">15.92</Matiere>
    <Matiere codeMatiere="G3EI39">15</Matiere>
  </Note>
  <Note>
    <CNE>18000049</CNE>
    <LastName>G3EI2_FN9</LastName>
    <FirstName>G3EI2_LN9</FirstName>
    <Matiere codeMatiere="G3EI31">17.15</Matiere>
    <Matiere codeMatiere="G3EI32">10.95</Matiere>
    <Matiere codeMatiere="G3EI33">17.83</Matiere>
    <Matiere codeMatiere="G3EI34">15</Matiere>
    <Matiere codeMatiere="G3EI35">12.65</Matiere>
    <Matiere codeMatiere="G3EI36">14.02</Matiere>
    <Matiere codeMatiere="G3EI37">15.78</Matiere>
    <Matiere codeMatiere="G3EI38">16.32</Matiere>
    <Matiere codeMatiere="G3EI39">4.5</Matiere>
  </Note>
  <Note>
    <CNE>18000050</CNE>
    <LastName>G3EI2_FN10</LastName>
    <FirstName>G3EI2_LN10</FirstName>
    <Matiere codeMatiere="G3EI31">11.85</Matiere>
    <Matiere codeMatiere="G3EI32">11.39</Matiere>
    <Matiere codeMatiere="G3EI33">9.67</Matiere>
    <Matiere codeMatiere="G3EI34">7.5</Matiere>
    <Matiere codeMatiere="G3EI35">9.26</Matiere>
    <Matiere codeMatiere="G3EI36">17.68</Matiere>
    <Matiere codeMatiere="G3EI37">18.55</Matiere>
    <Matiere codeMatiere="G3EI38">8.45</Matiere>
    <Matiere codeMatiere="G3EI39">10.74</Matiere>
  </Note>
</Notes>
