<?xml version="1.0"?>
<Notes xmlns:xsi="http://www.w3.org/2001/XMLSchema-instance" xsi:noNamespaceSchemaLocation="C://xampp/htdocs/GestionScolarite-XML/Validation_xml/Notes.xsd">
  <Note>
    <CNE>18000021</CNE>
    <LastName>Gsea2_LN1</LastName>
    <FirstName>Gsea2_FN1</FirstName>
    <Matiere codeMatiere="GSEA31">16</Matiere>
    <Matiere codeMatiere="GSEA32">10</Matiere>
    <Matiere codeMatiere="GSEA33">12</Matiere>
    <Matiere codeMatiere="GSEA34">12</Matiere>
    <Matiere codeMatiere="GSEA35">15</Matiere>
    <Matiere codeMatiere="GSEA36">17</Matiere>
    <Matiere codeMatiere="GSEA41">11</Matiere>
    <Matiere codeMatiere="GSEA42">15</Matiere>
    <Matiere codeMatiere="GSEA43">16</Matiere>
    <Matiere codeMatiere="GSEA44">12</Matiere>
    <Matiere codeMatiere="GSEA45">12</Matiere>
    <Matiere codeMatiere="GSEA46">16</Matiere>
  </Note>
  <Note>
    <CNE>18000022</CNE>
    <LastName>Gsea2_LN2</LastName>
    <FirstName>Gsea2_FN2</FirstName>
    <Matiere codeMatiere="GSEA31">12</Matiere>
    <Matiere codeMatiere="GSEA32">20</Matiere>
    <Matiere codeMatiere="GSEA33">12</Matiere>
    <Matiere codeMatiere="GSEA34">16</Matiere>
    <Matiere codeMatiere="GSEA35">15</Matiere>
    <Matiere codeMatiere="GSEA36">19</Matiere>
    <Matiere codeMatiere="GSEA41">13</Matiere>
    <Matiere codeMatiere="GSEA42">12</Matiere>
    <Matiere codeMatiere="GSEA43">12</Matiere>
    <Matiere codeMatiere="GSEA44">12</Matiere>
    <Matiere codeMatiere="GSEA45">17</Matiere>
    <Matiere codeMatiere="GSEA46">12</Matiere>
  </Note>
  <Note>
    <CNE>18000023</CNE>
    <LastName>Gsea2_LN3</LastName>
    <FirstName>Gsea2_FN3</FirstName>
    <Matiere codeMatiere="GSEA31">12</Matiere>
    <Matiere codeMatiere="GSEA32">12</Matiere>
    <Matiere codeMatiere="GSEA33">20</Matiere>
    <Matiere codeMatiere="GSEA34">15</Matiere>
    <Matiere codeMatiere="GSEA35">19</Matiere>
    <Matiere codeMatiere="GSEA36">15</Matiere>
    <Matiere codeMatiere="GSEA41">12</Matiere>
    <Matiere codeMatiere="GSEA42">19</Matiere>
    <Matiere codeMatiere="GSEA43">12</Matiere>
    <Matiere codeMatiere="GSEA44">15</Matiere>
    <Matiere codeMatiere="GSEA45">20</Matiere>
    <Matiere codeMatiere="GSEA46">15</Matiere>
  </Note>
  <Note>
    <CNE>18000024</CNE>
    <LastName>Gsea2_LN4</LastName>
    <FirstName>Gsea2_FN4</FirstName>
    <Matiere codeMatiere="GSEA31">20</Matiere>
    <Matiere codeMatiere="GSEA32">9</Matiere>
    <Matiere codeMatiere="GSEA33">20</Matiere>
    <Matiere codeMatiere="GSEA34">12</Matiere>
    <Matiere codeMatiere="GSEA35">12</Matiere>
    <Matiere codeMatiere="GSEA36">13</Matiere>
    <Matiere codeMatiere="GSEA41">10</Matiere>
    <Matiere codeMatiere="GSEA42">11</Matiere>
    <Matiere codeMatiere="GSEA43">10</Matiere>
    <Matiere codeMatiere="GSEA44">12</Matiere>
    <Matiere codeMatiere="GSEA45">13</Matiere>
    <Matiere codeMatiere="GSEA46">12</Matiere>
  </Note>
  <Note>
    <CNE>18000025</CNE>
    <LastName>Gsea2_LN5</LastName>
    <FirstName>Gsea2_FN5</FirstName>
    <Matiere codeMatiere="GSEA31">14</Matiere>
    <Matiere codeMatiere="GSEA32">12</Matiere>
    <Matiere codeMatiere="GSEA33">12</Matiere>
    <Matiere codeMatiere="GSEA34">15</Matiere>
    <Matiere codeMatiere="GSEA35">12</Matiere>
    <Matiere codeMatiere="GSEA36">18</Matiere>
    <Matiere codeMatiere="GSEA41">8</Matiere>
    <Matiere codeMatiere="GSEA42">12</Matiere>
    <Matiere codeMatiere="GSEA43">18</Matiere>
    <Matiere codeMatiere="GSEA44">13</Matiere>
    <Matiere codeMatiere="GSEA45">12</Matiere>
    <Matiere codeMatiere="GSEA46">12</Matiere>
  </Note>
  <Note>
    <CNE>18000026</CNE>
    <LastName>Gsea2_LN6</LastName>
    <FirstName>Gsea2_FN6</FirstName>
    <Matiere codeMatiere="GSEA31">12</Matiere>
    <Matiere codeMatiere="GSEA32">12</Matiere>
    <Matiere codeMatiere="GSEA33">15</Matiere>
    <Matiere codeMatiere="GSEA34">14</Matiere>
    <Matiere codeMatiere="GSEA35">18</Matiere>
    <Matiere codeMatiere="GSEA36">12</Matiere>
    <Matiere codeMatiere="GSEA41">20</Matiere>
    <Matiere codeMatiere="GSEA42">13</Matiere>
    <Matiere codeMatiere="GSEA43">15</Matiere>
    <Matiere codeMatiere="GSEA44">14</Matiere>
    <Matiere codeMatiere="GSEA45">15</Matiere>
    <Matiere codeMatiere="GSEA46">19</Matiere>
  </Note>
  <Note>
    <CNE>18000027</CNE>
    <LastName>Gsea2_LN7</LastName>
    <FirstName>Gsea2_FN7</FirstName>
    <Matiere codeMatiere="GSEA31">20</Matiere>
    <Matiere codeMatiere="GSEA32">16</Matiere>
    <Matiere codeMatiere="GSEA33">15</Matiere>
    <Matiere codeMatiere="GSEA34">17</Matiere>
    <Matiere codeMatiere="GSEA35">19</Matiere>
    <Matiere codeMatiere="GSEA36">12</Matiere>
    <Matiere codeMatiere="GSEA41">12</Matiere>
    <Matiere codeMatiere="GSEA42">9</Matiere>
    <Matiere codeMatiere="GSEA43">13</Matiere>
    <Matiere codeMatiere="GSEA44">12</Matiere>
    <Matiere codeMatiere="GSEA45">16</Matiere>
    <Matiere codeMatiere="GSEA46">17</Matiere>
  </Note>
  <Note>
    <CNE>18000028</CNE>
    <LastName>Gsea2_LN8</LastName>
    <FirstName>Gsea2_FN8</FirstName>
    <Matiere codeMatiere="GSEA31">19</Matiere>
    <Matiere codeMatiere="GSEA32">17</Matiere>
    <Matiere codeMatiere="GSEA33">16</Matiere>
    <Matiere codeMatiere="GSEA34">20</Matiere>
    <Matiere codeMatiere="GSEA35">18</Matiere>
    <Matiere codeMatiere="GSEA36">16</Matiere>
    <Matiere codeMatiere="GSEA41">12</Matiere>
    <Matiere codeMatiere="GSEA42">17</Matiere>
    <Matiere codeMatiere="GSEA43">13</Matiere>
    <Matiere codeMatiere="GSEA44">20</Matiere>
    <Matiere codeMatiere="GSEA45">12</Matiere>
    <Matiere codeMatiere="GSEA46">12</Matiere>
  </Note>
  <Note>
    <CNE>18000029</CNE>
    <LastName>Gsea2_LN9</LastName>
    <FirstName>Gsea2_FN9</FirstName>
    <Matiere codeMatiere="GSEA31">12</Matiere>
    <Matiere codeMatiere="GSEA32">18</Matiere>
    <Matiere codeMatiere="GSEA33">17</Matiere>
    <Matiere codeMatiere="GSEA34">10</Matiere>
    <Matiere codeMatiere="GSEA35">18</Matiere>
    <Matiere codeMatiere="GSEA36">14</Matiere>
    <Matiere codeMatiere="GSEA41">10</Matiere>
    <Matiere codeMatiere="GSEA42">14</Matiere>
    <Matiere codeMatiere="GSEA43">18</Matiere>
    <Matiere codeMatiere="GSEA44">18</Matiere>
    <Matiere codeMatiere="GSEA45">16</Matiere>
    <Matiere codeMatiere="GSEA46">19</Matiere>
  </Note>
  <Note>
    <CNE>18000030</CNE>
    <LastName>Gsea2_LN10</LastName>
    <FirstName>Gsea2_FN10</FirstName>
    <Matiere codeMatiere="GSEA31">12</Matiere>
    <Matiere codeMatiere="GSEA32">15</Matiere>
    <Matiere codeMatiere="GSEA33">12</Matiere>
    <Matiere codeMatiere="GSEA34">17</Matiere>
    <Matiere codeMatiere="GSEA35">12</Matiere>
    <Matiere codeMatiere="GSEA36">12</Matiere>
    <Matiere codeMatiere="GSEA41">7</Matiere>
    <Matiere codeMatiere="GSEA42">12</Matiere>
    <Matiere codeMatiere="GSEA43">14</Matiere>
    <Matiere codeMatiere="GSEA44">14</Matiere>
    <Matiere codeMatiere="GSEA45">13</Matiere>
    <Matiere codeMatiere="GSEA46">12</Matiere>
  </Note>
</Notes>
